{
  "venue": "demo-venue",
  "event_type": "SECURITY_INCIDENT",
  "detected_at": "2026-09-24T00:00:00Z",
  "reported_at": "2026-09-24T01:00:00Z",
  "affected_service": "demo hot/warm wallet layer",
  "estimated_impact_usd": null,
  "withdrawal_status": "UNKNOWN",
  "custody_scope": "UNKNOWN",
  "root_cause_status": "UNKNOWN",
  "official_source": "https://example.com/security-notice",
  "status": "ELEVATED",
  "freshness": "FRESH",
  "evidence_state": "OFFICIAL_CONFIRMED"
}
